{
  "schema_version": "1.0.0",
  "kind": "interactions_part",
  "path_id": "data_analyst",
  "batch_id": "final_batch_003_da_chunk",
  "tiles": [
    {
      "tile_id": "tile_stats_correlation",
      "interactions": [
        {
          "step_id": "tile_stats_correlation.s04",
          "interaction": {
            "type": "choice",
            "interaction_id": "ix.tile_stats_correlation.s04",
            "difficulty": "intro",
            "grading_mode": "client",
            "standalone": false,
            "measures": [
              {
                "concept_id": "stats.correlation",
                "capability": "distinguish_positive_from_negative_association",
                "fact_ids": [
                  "f2"
                ]
              }
            ],
            "anchors": [
              "stats.correlation#assessment:distinguish_positive_from_negative_association"
            ],
            "public": {
              "prompt": "QuickShip data shows that as distance_km increases, delivery_minutes also tends to increase. What kind of association is this?",
              "options": [
                {
                  "option_id": "opt_positive",
                  "text": "Positive association"
                },
                {
                  "option_id": "opt_negative",
                  "text": "Negative association"
                },
                {
                  "option_id": "opt_no_assoc",
                  "text": "No association — the variables are unrelated"
                },
                {
                  "option_id": "opt_causal",
                  "text": "Causal relationship — distance causes longer delivery"
                }
              ],
              "selection": "single",
              "shuffle": true
            },
            "grading": {
              "correct_option_ids": [
                "opt_positive"
              ],
              "option_feedback": {
                "opt_positive": {
                  "message": "Correct. When higher values of one variable tend to go with higher values of the other, that is a positive association."
                },
                "opt_negative": {
                  "message": "Not quite. A negative association means higher values of one variable tend to go with lower values of the other. Here both distance and delivery time increase together, so the association is positive."
                },
                "opt_no_assoc": {
                  "message": "Not quite. The variables do move together — farther orders tend to take longer. That is a positive association, not no association."
                },
                "opt_causal": {
                  "message": "Not quite. Correlation describes the direction of an association, not causation. The correct term for this pattern is a positive association."
                }
              }
            },
            "feedback": {
              "correct": {
                "message": "Right. Higher distance tends to go with higher delivery time — that is the definition of a positive association."
              },
              "incorrect": {
                "message": "Remember: positive means both variables tend to move in the same direction; negative means they move in opposite directions."
              },
              "hints": [
                "Think about whether the two variables move in the same direction or opposite directions.",
                "In a positive association, higher values of one variable tend to go with higher values of the other."
              ],
              "remediation_step_id": "tile_stats_correlation.r01"
            }
          }
        },
        {
          "step_id": "tile_stats_correlation.s05",
          "interaction": {
            "type": "choice",
            "interaction_id": "ix.tile_stats_correlation.s05",
            "difficulty": "core",
            "grading_mode": "client",
            "standalone": false,
            "measures": [
              {
                "concept_id": "stats.correlation",
                "capability": "recognize_linear_only_limit",
                "fact_ids": [
                  "m1"
                ]
              }
            ],
            "anchors": [
              "stats.correlation#assessment:recognize_linear_only_limit"
            ],
            "public": {
              "prompt": "A scatter plot shows a clear U-shaped curve between two variables, yet the computed correlation coefficient is close to 0. What does this tell you?",
              "options": [
                {
                  "option_id": "opt_no_rel",
                  "text": "There is no relationship between the two variables"
                },
                {
                  "option_id": "opt_linear_only",
                  "text": "Correlation only captures linear relationships; a strong nonlinear relationship can still produce a near-zero value"
                },
                {
                  "option_id": "opt_weak",
                  "text": "The relationship is weak because the correlation is near 0"
                },
                {
                  "option_id": "opt_error",
                  "text": "The correlation was calculated incorrectly"
                }
              ],
              "selection": "single",
              "shuffle": true
            },
            "grading": {
              "correct_option_ids": [
                "opt_linear_only"
              ],
              "option_feedback": {
                "opt_linear_only": {
                  "message": "Correct. Correlation quantifies the strength of a linear relationship only. A nonlinear relationship can be strong even when its correlation value looks weak."
                },
                "opt_no_rel": {
                  "message": "Not quite. The U-shaped curve is a clear relationship — it is just nonlinear. Correlation near 0 means little or no linear relationship, not no relationship at all."
                },
                "opt_weak": {
                  "message": "Not quite. The relationship is strong — it is just nonlinear. Correlation near 0 only means the linear component is weak; it says nothing about nonlinear patterns."
                },
                "opt_error": {
                  "message": "Not quite. The calculation is correct. Correlation near 0 for a U-shaped pattern is expected because correlation only measures linear association."
                }
              }
            },
            "feedback": {
              "correct": {
                "message": "Exactly. Correlation measures only linear association; a strong nonlinear pattern can still yield a near-zero correlation."
              },
              "incorrect": {
                "message": "Recall that correlation is limited to linear relationships. A near-zero value does not rule out a strong nonlinear pattern."
              },
              "hints": [
                "What kind of relationship does the correlation coefficient measure?",
                "A U-shaped curve is a nonlinear pattern. Does correlation capture nonlinear patterns?"
              ],
              "remediation_step_id": "tile_stats_correlation.r01"
            }
          }
        },
        {
          "step_id": "tile_stats_correlation.s06",
          "interaction": {
            "type": "table_select",
            "interaction_id": "ix.tile_stats_correlation.s06",
            "difficulty": "core",
            "grading_mode": "client",
            "standalone": false,
            "measures": [
              {
                "concept_id": "stats.correlation",
                "capability": "state_correlation_range_and_meaning",
                "fact_ids": [
                  "f1"
                ]
              },
              {
                "concept_id": "stats.correlation",
                "capability": "read_correlation_strength_and_direction",
                "fact_ids": [
                  "f3"
                ]
              }
            ],
            "anchors": [
              "stats.correlation#practice",
              "stats.correlation#assessment:state_correlation_range_and_meaning",
              "stats.correlation#assessment:read_correlation_strength_and_direction"
            ],
            "public": {
              "asset_ref": {
                "asset_id": "ds_correlation_matrix",
                "variant_id": null,
                "columns": [
                  "variable",
                  "distance_km",
                  "package_weight_kg",
                  "delivery_minutes"
                ]
              },
              "intro": "The table shows pairwise Pearson correlation coefficients for three QuickShip variables. Use it to answer the tasks below.",
              "tasks": [
                {
                  "task_id": "task_strongest_pair",
                  "prompt": "Select the cell showing the strongest linear relationship between any two different variables (highest absolute value, excluding the diagonal).",
                  "target_kind": "cell"
                },
                {
                  "task_id": "task_negative_pair",
                  "prompt": "Select the cell showing a negative association between package_weight_kg and delivery_minutes.",
                  "target_kind": "cell"
                },
                {
                  "task_id": "task_weakest_pair",
                  "prompt": "Select the cell showing the weakest relationship between any two different variables (lowest absolute value, excluding the diagonal).",
                  "target_kind": "cell"
                }
              ]
            },
            "grading": {
              "answers": [
                {
                  "task_id": "task_strongest_pair",
                  "row": {
                    "where": {
                      "variable": "distance_km"
                    }
                  },